171 reactive apps
~155 statements/sec, 3.5 second dump, 113.86324 seconds, 17647 statements

No.     Time           Source                Destination           Protocol Length Info
     12 0.224024       10.240.0.60           130.211.203.133       MySQL    1124   Request Prepare Statement

Frame 12: 1124 bytes on wire (8992 bits), 1124 bytes captured (8992 bits)
Ethernet II, Src: 42:01:0a:f0:00:3c (42:01:0a:f0:00:3c), Dst: 42:01:0a:f0:00:01 (42:01:0a:f0:00:01)
Internet Protocol Version 4, Src: 10.240.0.60, Dst: 130.211.203.133
Transmission Control Protocol, Src Port: 40280 (40280), Dst Port: 3306 (3306), Seq: 18, Ack: 57, Len: 1058
[2 Reassembled TCP Segments (1062 bytes): #11(4), #12(1058)]
MySQL Protocol
    Packet Length: 1058
    Packet Number: 0
    Request Command Prepare Statement
        Command: Prepare Statement (22)
        Statement [truncated]: select `instance`.`id`, `instance`.`name`, `instance`.`account_id`, `instance`.`kind`, `instance`.`uuid`, `instance`.`description`, `instance`.`state`, `instance`.`created`, `instance`.`removed`, `instance`.`remove_t

No.     Time           Source                Destination           Protocol Length Info
     29 0.226855       10.240.0.60           130.211.203.133       MySQL    1090   Request Prepare Statement

Frame 29: 1090 bytes on wire (8720 bits), 1090 bytes captured (8720 bits)
Ethernet II, Src: 42:01:0a:f0:00:3c (42:01:0a:f0:00:3c), Dst: 42:01:0a:f0:00:01 (42:01:0a:f0:00:01)
Internet Protocol Version 4, Src: 10.240.0.60, Dst: 130.211.203.133
Transmission Control Protocol, Src Port: 40280 (40280), Dst Port: 3306 (3306), Seq: 1140, Ack: 11738, Len: 1024
[2 Reassembled TCP Segments (1028 bytes): #28(4), #29(1024)]
MySQL Protocol
    Packet Length: 1024
    Packet Number: 0
    Request Command Prepare Statement
        Command: Prepare Statement (22)
        Statement [truncated]: select `instance`.`id`, `instance`.`name`, `instance`.`account_id`, `instance`.`kind`, `instance`.`uuid`, `instance`.`description`, `instance`.`state`, `instance`.`created`, `instance`.`removed`, `instance`.`remove_t

No.     Time           Source                Destination           Protocol Length Info
     47 0.228810       10.240.0.60           130.211.203.133       MySQL    326    Request Prepare Statement

Frame 47: 326 bytes on wire (2608 bits), 326 bytes captured (2608 bits)
Ethernet II, Src: 42:01:0a:f0:00:3c (42:01:0a:f0:00:3c), Dst: 42:01:0a:f0:00:01 (42:01:0a:f0:00:01)
Internet Protocol Version 4, Src: 10.240.0.60, Dst: 130.211.203.133
Transmission Control Protocol, Src Port: 40280 (40280), Dst Port: 3306 (3306), Seq: 2216, Ack: 19235, Len: 260
[2 Reassembled TCP Segments (264 bytes): #46(4), #47(260)]
MySQL Protocol
    Packet Length: 260
    Packet Number: 0
    Request Command Prepare Statement
        Command: Prepare Statement (22)
        Statement [truncated]: insert into `process_instance` (`start_time`, `end_time`, `data`, `priority`, `process_name`, `resource_type`, `resource_id`, `result`, `exit_reason`, `phase`, `start_process_server_id`, `running_process_server_id`) 

No.     Time           Source                Destination           Protocol Length Info
     61 0.233486       10.240.0.60           130.211.203.133       MySQL    567    Request Prepare Statement

Frame 61: 567 bytes on wire (4536 bits), 567 bytes captured (4536 bits)
Ethernet II, Src: 42:01:0a:f0:00:3c (42:01:0a:f0:00:3c), Dst: 42:01:0a:f0:00:01 (42:01:0a:f0:00:01)
Internet Protocol Version 4, Src: 10.240.0.60, Dst: 130.211.203.133
Transmission Control Protocol, Src Port: 40280 (40280), Dst Port: 3306 (3306), Seq: 2613, Ack: 19653, Len: 501
[2 Reassembled TCP Segments (505 bytes): #60(4), #61(501)]
MySQL Protocol
    Packet Length: 501
    Packet Number: 0
    Request Command Prepare Statement
        Command: Prepare Statement (22)
        Statement [truncated]: select `process_instance`.`id`, `process_instance`.`start_time`, `process_instance`.`end_time`, `process_instance`.`data`, `process_instance`.`priority`, `process_instance`.`process_name`, `process_instance`.`resourc

No.     Time           Source                Destination           Protocol Length Info
     76 0.235891       10.240.0.60           130.211.203.133       MySQL    1090   Request Prepare Statement

Frame 76: 1090 bytes on wire (8720 bits), 1090 bytes captured (8720 bits)
Ethernet II, Src: 42:01:0a:f0:00:3c (42:01:0a:f0:00:3c), Dst: 42:01:0a:f0:00:01 (42:01:0a:f0:00:01)
Internet Protocol Version 4, Src: 10.240.0.60, Dst: 130.211.203.133
Transmission Control Protocol, Src Port: 40280 (40280), Dst Port: 3306 (3306), Seq: 3166, Ack: 22090, Len: 1024
[2 Reassembled TCP Segments (1028 bytes): #75(4), #76(1024)]
MySQL Protocol
    Packet Length: 1024
    Packet Number: 0
    Request Command Prepare Statement
        Command: Prepare Statement (22)
        Statement [truncated]: select `instance`.`id`, `instance`.`name`, `instance`.`account_id`, `instance`.`kind`, `instance`.`uuid`, `instance`.`description`, `instance`.`state`, `instance`.`created`, `instance`.`removed`, `instance`.`remove_t

No.     Time           Source                Destination           Protocol Length Info
     93 0.238464       10.240.0.60           130.211.203.133       MySQL    1101   Request Prepare Statement

Frame 93: 1101 bytes on wire (8808 bits), 1101 bytes captured (8808 bits)
Ethernet II, Src: 42:01:0a:f0:00:3c (42:01:0a:f0:00:3c), Dst: 42:01:0a:f0:00:01 (42:01:0a:f0:00:01)
Internet Protocol Version 4, Src: 10.240.0.60, Dst: 130.211.203.133
Transmission Control Protocol, Src Port: 40280 (40280), Dst Port: 3306 (3306), Seq: 4242, Ack: 29587, Len: 1035
[2 Reassembled TCP Segments (1039 bytes): #92(4), #93(1035)]
MySQL Protocol
    Packet Length: 1035
    Packet Number: 0
    Request Command Prepare Statement
        Command: Prepare Statement (22)
        Statement [truncated]: select `instance`.`id`, `instance`.`name`, `instance`.`account_id`, `instance`.`kind`, `instance`.`uuid`, `instance`.`description`, `instance`.`state`, `instance`.`created`, `instance`.`removed`, `instance`.`remove_t

No.     Time           Source                Destination           Protocol Length Info
    111 0.240632       10.240.0.60           130.211.203.133       MySQL    160    Request Prepare Statement

Frame 111: 160 bytes on wire (1280 bits), 160 bytes captured (1280 bits)
Ethernet II, Src: 42:01:0a:f0:00:3c (42:01:0a:f0:00:3c), Dst: 42:01:0a:f0:00:01 (42:01:0a:f0:00:01)
Internet Protocol Version 4, Src: 10.240.0.60, Dst: 130.211.203.133
Transmission Control Protocol, Src Port: 40280 (40280), Dst Port: 3306 (3306), Seq: 5329, Ack: 37084, Len: 94
[2 Reassembled TCP Segments (98 bytes): #110(4), #111(94)]
MySQL Protocol
    Packet Length: 94
    Packet Number: 0
    Request Command Prepare Statement
        Command: Prepare Statement (22)
        Statement: update `instance` set `instance`.`state` = ?, `instance`.`data` = ? where `instance`.`id` = ?

No.     Time           Source                Destination           Protocol Length Info
    126 0.246136       10.240.0.60           130.211.203.133       MySQL    1090   Request Prepare Statement

Frame 126: 1090 bytes on wire (8720 bits), 1090 bytes captured (8720 bits)
Ethernet II, Src: 42:01:0a:f0:00:3c (42:01:0a:f0:00:3c), Dst: 42:01:0a:f0:00:01 (42:01:0a:f0:00:01)
Internet Protocol Version 4, Src: 10.240.0.60, Dst: 130.211.203.133
Transmission Control Protocol, Src Port: 40280 (40280), Dst Port: 3306 (3306), Seq: 7084, Ack: 37298, Len: 1024
[2 Reassembled TCP Segments (1028 bytes): #125(4), #126(1024)]
MySQL Protocol
    Packet Length: 1024
    Packet Number: 0
    Request Command Prepare Statement
        Command: Prepare Statement (22)
        Statement [truncated]: select `instance`.`id`, `instance`.`name`, `instance`.`account_id`, `instance`.`kind`, `instance`.`uuid`, `instance`.`description`, `instance`.`state`, `instance`.`created`, `instance`.`removed`, `instance`.`remove_t

No.     Time           Source                Destination           Protocol Length Info
    143 0.248314       10.240.0.60           130.211.203.133       MySQL    567    Request Prepare Statement

Frame 143: 567 bytes on wire (4536 bits), 567 bytes captured (4536 bits)
Ethernet II, Src: 42:01:0a:f0:00:3c (42:01:0a:f0:00:3c), Dst: 42:01:0a:f0:00:01 (42:01:0a:f0:00:01)
Internet Protocol Version 4, Src: 10.240.0.60, Dst: 130.211.203.133
Transmission Control Protocol, Src Port: 40280 (40280), Dst Port: 3306 (3306), Seq: 8160, Ack: 44695, Len: 501
[2 Reassembled TCP Segments (505 bytes): #142(4), #143(501)]
MySQL Protocol
    Packet Length: 501
    Packet Number: 0
    Request Command Prepare Statement
        Command: Prepare Statement (22)
        Statement [truncated]: select `process_instance`.`id`, `process_instance`.`start_time`, `process_instance`.`end_time`, `process_instance`.`data`, `process_instance`.`priority`, `process_instance`.`process_name`, `process_instance`.`resourc

No.     Time           Source                Destination           Protocol Length Info
    158 0.250191       10.240.0.60           130.211.203.133       MySQL    589    Request Prepare Statement

Frame 158: 589 bytes on wire (4712 bits), 589 bytes captured (4712 bits)
Ethernet II, Src: 42:01:0a:f0:00:3c (42:01:0a:f0:00:3c), Dst: 42:01:0a:f0:00:01 (42:01:0a:f0:00:01)
Internet Protocol Version 4, Src: 10.240.0.60, Dst: 130.211.203.133
Transmission Control Protocol, Src Port: 40280 (40280), Dst Port: 3306 (3306), Seq: 8713, Ack: 47132, Len: 523
[2 Reassembled TCP Segments (527 bytes): #157(4), #158(523)]
MySQL Protocol
    Packet Length: 523
    Packet Number: 0
    Request Command Prepare Statement
        Command: Prepare Statement (22)
        Statement [truncated]: update `process_instance` set `process_instance`.`start_time` = ?, `process_instance`.`end_time` = ?, `process_instance`.`data` = ?, `process_instance`.`priority` = ?, `process_instance`.`process_name` = ?, `process_

No.     Time           Source                Destination           Protocol Length Info
    174 0.254993       10.240.0.60           130.211.203.133       MySQL    1090   Request Prepare Statement

Frame 174: 1090 bytes on wire (8720 bits), 1090 bytes captured (8720 bits)
Ethernet II, Src: 42:01:0a:f0:00:3c (42:01:0a:f0:00:3c), Dst: 42:01:0a:f0:00:01 (42:01:0a:f0:00:01)
Internet Protocol Version 4, Src: 10.240.0.60, Dst: 130.211.203.133
Transmission Control Protocol, Src Port: 40280 (40280), Dst Port: 3306 (3306), Seq: 9393, Ack: 47616, Len: 1024
[2 Reassembled TCP Segments (1028 bytes): #173(4), #174(1024)]
MySQL Protocol
    Packet Length: 1024
    Packet Number: 0
    Request Command Prepare Statement
        Command: Prepare Statement (22)
        Statement [truncated]: select `instance`.`id`, `instance`.`name`, `instance`.`account_id`, `instance`.`kind`, `instance`.`uuid`, `instance`.`description`, `instance`.`state`, `instance`.`created`, `instance`.`removed`, `instance`.`remove_t

No.     Time           Source                Destination           Protocol Length Info
    192 0.257095       10.240.0.60           130.211.203.133       MySQL    326    Request Prepare Statement

Frame 192: 326 bytes on wire (2608 bits), 326 bytes captured (2608 bits)
Ethernet II, Src: 42:01:0a:f0:00:3c (42:01:0a:f0:00:3c), Dst: 42:01:0a:f0:00:01 (42:01:0a:f0:00:01)
Internet Protocol Version 4, Src: 10.240.0.60, Dst: 130.211.203.133
Transmission Control Protocol, Src Port: 40280 (40280), Dst Port: 3306 (3306), Seq: 10469, Ack: 55107, Len: 260
[2 Reassembled TCP Segments (264 bytes): #191(4), #192(260)]
MySQL Protocol
    Packet Length: 260
    Packet Number: 0
    Request Command Prepare Statement
        Command: Prepare Statement (22)
        Statement [truncated]: insert into `process_instance` (`start_time`, `end_time`, `data`, `priority`, `process_name`, `resource_type`, `resource_id`, `result`, `exit_reason`, `phase`, `start_process_server_id`, `running_process_server_id`) 

No.     Time           Source                Destination           Protocol Length Info
    206 0.261689       10.240.0.60           130.211.203.133       MySQL    567    Request Prepare Statement

Frame 206: 567 bytes on wire (4536 bits), 567 bytes captured (4536 bits)
Ethernet II, Src: 42:01:0a:f0:00:3c (42:01:0a:f0:00:3c), Dst: 42:01:0a:f0:00:01 (42:01:0a:f0:00:01)
Internet Protocol Version 4, Src: 10.240.0.60, Dst: 130.211.203.133
Transmission Control Protocol, Src Port: 40280 (40280), Dst Port: 3306 (3306), Seq: 10866, Ack: 55525, Len: 501
[2 Reassembled TCP Segments (505 bytes): #205(4), #206(501)]
MySQL Protocol
    Packet Length: 501
    Packet Number: 0
    Request Command Prepare Statement
        Command: Prepare Statement (22)
        Statement [truncated]: select `process_instance`.`id`, `process_instance`.`start_time`, `process_instance`.`end_time`, `process_instance`.`data`, `process_instance`.`priority`, `process_instance`.`process_name`, `process_instance`.`resourc

No.     Time           Source                Destination           Protocol Length Info
    221 0.263938       10.240.0.60           130.211.203.133       MySQL    1090   Request Prepare Statement

Frame 221: 1090 bytes on wire (8720 bits), 1090 bytes captured (8720 bits)
Ethernet II, Src: 42:01:0a:f0:00:3c (42:01:0a:f0:00:3c), Dst: 42:01:0a:f0:00:01 (42:01:0a:f0:00:01)
Internet Protocol Version 4, Src: 10.240.0.60, Dst: 130.211.203.133
Transmission Control Protocol, Src Port: 40280 (40280), Dst Port: 3306 (3306), Seq: 11419, Ack: 57962, Len: 1024
[2 Reassembled TCP Segments (1028 bytes): #220(4), #221(1024)]
MySQL Protocol
    Packet Length: 1024
    Packet Number: 0
    Request Command Prepare Statement
        Command: Prepare Statement (22)
        Statement [truncated]: select `instance`.`id`, `instance`.`name`, `instance`.`account_id`, `instance`.`kind`, `instance`.`uuid`, `instance`.`description`, `instance`.`state`, `instance`.`created`, `instance`.`removed`, `instance`.`remove_t

No.     Time           Source                Destination           Protocol Length Info
    239 0.266477       10.240.0.60           130.211.203.133       MySQL    1101   Request Prepare Statement

Frame 239: 1101 bytes on wire (8808 bits), 1101 bytes captured (8808 bits)
Ethernet II, Src: 42:01:0a:f0:00:3c (42:01:0a:f0:00:3c), Dst: 42:01:0a:f0:00:01 (42:01:0a:f0:00:01)
Internet Protocol Version 4, Src: 10.240.0.60, Dst: 130.211.203.133
Transmission Control Protocol, Src Port: 40280 (40280), Dst Port: 3306 (3306), Seq: 12495, Ack: 65453, Len: 1035
[2 Reassembled TCP Segments (1039 bytes): #238(4), #239(1035)]
MySQL Protocol
    Packet Length: 1035
    Packet Number: 0
    Request Command Prepare Statement
        Command: Prepare Statement (22)
        Statement [truncated]: select `instance`.`id`, `instance`.`name`, `instance`.`account_id`, `instance`.`kind`, `instance`.`uuid`, `instance`.`description`, `instance`.`state`, `instance`.`created`, `instance`.`removed`, `instance`.`remove_t

No.     Time           Source                Destination           Protocol Length Info
    257 0.268587       10.240.0.60           130.211.203.133       MySQL    160    Request Prepare Statement

Frame 257: 160 bytes on wire (1280 bits), 160 bytes captured (1280 bits)
Ethernet II, Src: 42:01:0a:f0:00:3c (42:01:0a:f0:00:3c), Dst: 42:01:0a:f0:00:01 (42:01:0a:f0:00:01)
Internet Protocol Version 4, Src: 10.240.0.60, Dst: 130.211.203.133
Transmission Control Protocol, Src Port: 40280 (40280), Dst Port: 3306 (3306), Seq: 13582, Ack: 72944, Len: 94
[2 Reassembled TCP Segments (98 bytes): #256(4), #257(94)]
MySQL Protocol
    Packet Length: 94
    Packet Number: 0
    Request Command Prepare Statement
        Command: Prepare Statement (22)
        Statement: update `instance` set `instance`.`state` = ?, `instance`.`data` = ? where `instance`.`id` = ?

No.     Time           Source                Destination           Protocol Length Info
    272 0.273819       10.240.0.60           130.211.203.133       MySQL    1090   Request Prepare Statement

Frame 272: 1090 bytes on wire (8720 bits), 1090 bytes captured (8720 bits)
Ethernet II, Src: 42:01:0a:f0:00:3c (42:01:0a:f0:00:3c), Dst: 42:01:0a:f0:00:01 (42:01:0a:f0:00:01)
Internet Protocol Version 4, Src: 10.240.0.60, Dst: 130.211.203.133
Transmission Control Protocol, Src Port: 40280 (40280), Dst Port: 3306 (3306), Seq: 15331, Ack: 73158, Len: 1024
[2 Reassembled TCP Segments (1028 bytes): #271(4), #272(1024)]
MySQL Protocol
    Packet Length: 1024
    Packet Number: 0
    Request Command Prepare Statement
        Command: Prepare Statement (22)
        Statement [truncated]: select `instance`.`id`, `instance`.`name`, `instance`.`account_id`, `instance`.`kind`, `instance`.`uuid`, `instance`.`description`, `instance`.`state`, `instance`.`created`, `instance`.`removed`, `instance`.`remove_t

No.     Time           Source                Destination           Protocol Length Info
    288 0.278852       10.240.0.60           130.211.203.133       MySQL    567    Request Prepare Statement

Frame 288: 567 bytes on wire (4536 bits), 567 bytes captured (4536 bits)
Ethernet II, Src: 42:01:0a:f0:00:3c (42:01:0a:f0:00:3c), Dst: 42:01:0a:f0:00:01 (42:01:0a:f0:00:01)
Internet Protocol Version 4, Src: 10.240.0.60, Dst: 130.211.203.133
Transmission Control Protocol, Src Port: 40280 (40280), Dst Port: 3306 (3306), Seq: 16407, Ack: 80549, Len: 501
[2 Reassembled TCP Segments (505 bytes): #287(4), #288(501)]
MySQL Protocol
    Packet Length: 501
    Packet Number: 0
    Request Command Prepare Statement
        Command: Prepare Statement (22)
        Statement [truncated]: select `process_instance`.`id`, `process_instance`.`start_time`, `process_instance`.`end_time`, `process_instance`.`data`, `process_instance`.`priority`, `process_instance`.`process_name`, `process_instance`.`resourc

No.     Time           Source                Destination           Protocol Length Info
    303 0.280884       10.240.0.60           130.211.203.133       MySQL    589    Request Prepare Statement

Frame 303: 589 bytes on wire (4712 bits), 589 bytes captured (4712 bits)
Ethernet II, Src: 42:01:0a:f0:00:3c (42:01:0a:f0:00:3c), Dst: 42:01:0a:f0:00:01 (42:01:0a:f0:00:01)
Internet Protocol Version 4, Src: 10.240.0.60, Dst: 130.211.203.133
Transmission Control Protocol, Src Port: 40280 (40280), Dst Port: 3306 (3306), Seq: 16960, Ack: 82986, Len: 523
[2 Reassembled TCP Segments (527 bytes): #302(4), #303(523)]
MySQL Protocol
    Packet Length: 523
    Packet Number: 0
    Request Command Prepare Statement
        Command: Prepare Statement (22)
        Statement [truncated]: update `process_instance` set `process_instance`.`start_time` = ?, `process_instance`.`end_time` = ?, `process_instance`.`data` = ?, `process_instance`.`priority` = ?, `process_instance`.`process_name` = ?, `process_

No.     Time           Source                Destination           Protocol Length Info
    318 0.285586       10.240.0.60           130.211.203.133       MySQL    1090   Request Prepare Statement

Frame 318: 1090 bytes on wire (8720 bits), 1090 bytes captured (8720 bits)
Ethernet II, Src: 42:01:0a:f0:00:3c (42:01:0a:f0:00:3c), Dst: 42:01:0a:f0:00:01 (42:01:0a:f0:00:01)
Internet Protocol Version 4, Src: 10.240.0.60, Dst: 130.211.203.133
Transmission Control Protocol, Src Port: 40280 (40280), Dst Port: 3306 (3306), Seq: 17640, Ack: 83470, Len: 1024
[2 Reassembled TCP Segments (1028 bytes): #317(4), #318(1024)]
MySQL Protocol
    Packet Length: 1024
    Packet Number: 0
    Request Command Prepare Statement
        Command: Prepare Statement (22)
        Statement [truncated]: select `instance`.`id`, `instance`.`name`, `instance`.`account_id`, `instance`.`kind`, `instance`.`uuid`, `instance`.`description`, `instance`.`state`, `instance`.`created`, `instance`.`removed`, `instance`.`remove_t

No.     Time           Source                Destination           Protocol Length Info
    336 0.287577       10.240.0.60           130.211.203.133       MySQL    326    Request Prepare Statement

Frame 336: 326 bytes on wire (2608 bits), 326 bytes captured (2608 bits)
Ethernet II, Src: 42:01:0a:f0:00:3c (42:01:0a:f0:00:3c), Dst: 42:01:0a:f0:00:01 (42:01:0a:f0:00:01)
Internet Protocol Version 4, Src: 10.240.0.60, Dst: 130.211.203.133
Transmission Control Protocol, Src Port: 40280 (40280), Dst Port: 3306 (3306), Seq: 18716, Ack: 90960, Len: 260
[2 Reassembled TCP Segments (264 bytes): #335(4), #336(260)]
MySQL Protocol
    Packet Length: 260
    Packet Number: 0
    Request Command Prepare Statement
        Command: Prepare Statement (22)
        Statement [truncated]: insert into `process_instance` (`start_time`, `end_time`, `data`, `priority`, `process_name`, `resource_type`, `resource_id`, `result`, `exit_reason`, `phase`, `start_process_server_id`, `running_process_server_id`) 

No.     Time           Source                Destination           Protocol Length Info
    350 0.291604       10.240.0.60           130.211.203.133       MySQL    567    Request Prepare Statement

Frame 350: 567 bytes on wire (4536 bits), 567 bytes captured (4536 bits)
Ethernet II, Src: 42:01:0a:f0:00:3c (42:01:0a:f0:00:3c), Dst: 42:01:0a:f0:00:01 (42:01:0a:f0:00:01)
Internet Protocol Version 4, Src: 10.240.0.60, Dst: 130.211.203.133
Transmission Control Protocol, Src Port: 40280 (40280), Dst Port: 3306 (3306), Seq: 19113, Ack: 91378, Len: 501
[2 Reassembled TCP Segments (505 bytes): #349(4), #350(501)]
MySQL Protocol
    Packet Length: 501
    Packet Number: 0
    Request Command Prepare Statement
        Command: Prepare Statement (22)
        Statement [truncated]: select `process_instance`.`id`, `process_instance`.`start_time`, `process_instance`.`end_time`, `process_instance`.`data`, `process_instance`.`priority`, `process_instance`.`process_name`, `process_instance`.`resourc

No.     Time           Source                Destination           Protocol Length Info
    365 0.293927       10.240.0.60           130.211.203.133       MySQL    1090   Request Prepare Statement

Frame 365: 1090 bytes on wire (8720 bits), 1090 bytes captured (8720 bits)
Ethernet II, Src: 42:01:0a:f0:00:3c (42:01:0a:f0:00:3c), Dst: 42:01:0a:f0:00:01 (42:01:0a:f0:00:01)
Internet Protocol Version 4, Src: 10.240.0.60, Dst: 130.211.203.133
Transmission Control Protocol, Src Port: 40280 (40280), Dst Port: 3306 (3306), Seq: 19666, Ack: 93815, Len: 1024
[2 Reassembled TCP Segments (1028 bytes): #364(4), #365(1024)]
MySQL Protocol
    Packet Length: 1024
    Packet Number: 0
    Request Command Prepare Statement
        Command: Prepare Statement (22)
        Statement [truncated]: select `instance`.`id`, `instance`.`name`, `instance`.`account_id`, `instance`.`kind`, `instance`.`uuid`, `instance`.`description`, `instance`.`state`, `instance`.`created`, `instance`.`removed`, `instance`.`remove_t

No.     Time           Source                Destination           Protocol Length Info
    383 0.296361       10.240.0.60           130.211.203.133       MySQL    1101   Request Prepare Statement

Frame 383: 1101 bytes on wire (8808 bits), 1101 bytes captured (8808 bits)
Ethernet II, Src: 42:01:0a:f0:00:3c (42:01:0a:f0:00:3c), Dst: 42:01:0a:f0:00:01 (42:01:0a:f0:00:01)
Internet Protocol Version 4, Src: 10.240.0.60, Dst: 130.211.203.133
Transmission Control Protocol, Src Port: 40280 (40280), Dst Port: 3306 (3306), Seq: 20742, Ack: 101305, Len: 1035
[2 Reassembled TCP Segments (1039 bytes): #382(4), #383(1035)]
MySQL Protocol
    Packet Length: 1035
    Packet Number: 0
    Request Command Prepare Statement
        Command: Prepare Statement (22)
        Statement [truncated]: select `instance`.`id`, `instance`.`name`, `instance`.`account_id`, `instance`.`kind`, `instance`.`uuid`, `instance`.`description`, `instance`.`state`, `instance`.`created`, `instance`.`removed`, `instance`.`remove_t

No.     Time           Source                Destination           Protocol Length Info
    401 0.298562       10.240.0.60           130.211.203.133       MySQL    160    Request Prepare Statement

Frame 401: 160 bytes on wire (1280 bits), 160 bytes captured (1280 bits)
Ethernet II, Src: 42:01:0a:f0:00:3c (42:01:0a:f0:00:3c), Dst: 42:01:0a:f0:00:01 (42:01:0a:f0:00:01)
Internet Protocol Version 4, Src: 10.240.0.60, Dst: 130.211.203.133
Transmission Control Protocol, Src Port: 40280 (40280), Dst Port: 3306 (3306), Seq: 21829, Ack: 108795, Len: 94
[2 Reassembled TCP Segments (98 bytes): #400(4), #401(94)]
MySQL Protocol
    Packet Length: 94
    Packet Number: 0
    Request Command Prepare Statement
        Command: Prepare Statement (22)
        Statement: update `instance` set `instance`.`state` = ?, `instance`.`data` = ? where `instance`.`id` = ?

No.     Time           Source                Destination           Protocol Length Info
    416 0.303493       10.240.0.60           130.211.203.133       MySQL    1090   Request Prepare Statement

Frame 416: 1090 bytes on wire (8720 bits), 1090 bytes captured (8720 bits)
Ethernet II, Src: 42:01:0a:f0:00:3c (42:01:0a:f0:00:3c), Dst: 42:01:0a:f0:00:01 (42:01:0a:f0:00:01)
Internet Protocol Version 4, Src: 10.240.0.60, Dst: 130.211.203.133
Transmission Control Protocol, Src Port: 40280 (40280), Dst Port: 3306 (3306), Seq: 23578, Ack: 109009, Len: 1024
[2 Reassembled TCP Segments (1028 bytes): #415(4), #416(1024)]
MySQL Protocol
    Packet Length: 1024
    Packet Number: 0
    Request Command Prepare Statement
        Command: Prepare Statement (22)
        Statement [truncated]: select `instance`.`id`, `instance`.`name`, `instance`.`account_id`, `instance`.`kind`, `instance`.`uuid`, `instance`.`description`, `instance`.`state`, `instance`.`created`, `instance`.`removed`, `instance`.`remove_t

No.     Time           Source                Destination           Protocol Length Info
    433 0.305918       10.240.0.60           130.211.203.133       MySQL    567    Request Prepare Statement

Frame 433: 567 bytes on wire (4536 bits), 567 bytes captured (4536 bits)
Ethernet II, Src: 42:01:0a:f0:00:3c (42:01:0a:f0:00:3c), Dst: 42:01:0a:f0:00:01 (42:01:0a:f0:00:01)
Internet Protocol Version 4, Src: 10.240.0.60, Dst: 130.211.203.133
Transmission Control Protocol, Src Port: 40280 (40280), Dst Port: 3306 (3306), Seq: 24654, Ack: 116399, Len: 501
[2 Reassembled TCP Segments (505 bytes): #432(4), #433(501)]
MySQL Protocol
    Packet Length: 501
    Packet Number: 0
    Request Command Prepare Statement
        Command: Prepare Statement (22)
        Statement [truncated]: select `process_instance`.`id`, `process_instance`.`start_time`, `process_instance`.`end_time`, `process_instance`.`data`, `process_instance`.`priority`, `process_instance`.`process_name`, `process_instance`.`resourc

No.     Time           Source                Destination           Protocol Length Info
    448 0.308126       10.240.0.60           130.211.203.133       MySQL    589    Request Prepare Statement

Frame 448: 589 bytes on wire (4712 bits), 589 bytes captured (4712 bits)
Ethernet II, Src: 42:01:0a:f0:00:3c (42:01:0a:f0:00:3c), Dst: 42:01:0a:f0:00:01 (42:01:0a:f0:00:01)
Internet Protocol Version 4, Src: 10.240.0.60, Dst: 130.211.203.133
Transmission Control Protocol, Src Port: 40280 (40280), Dst Port: 3306 (3306), Seq: 25207, Ack: 118836, Len: 523
[2 Reassembled TCP Segments (527 bytes): #447(4), #448(523)]
MySQL Protocol
    Packet Length: 523
    Packet Number: 0
    Request Command Prepare Statement
        Command: Prepare Statement (22)
        Statement [truncated]: update `process_instance` set `process_instance`.`start_time` = ?, `process_instance`.`end_time` = ?, `process_instance`.`data` = ?, `process_instance`.`priority` = ?, `process_instance`.`process_name` = ?, `process_

No.     Time           Source                Destination           Protocol Length Info
    467 0.313539       10.240.0.60           130.211.203.133       MySQL    567    Request Prepare Statement

Frame 467: 567 bytes on wire (4536 bits), 567 bytes captured (4536 bits)
Ethernet II, Src: 42:01:0a:f0:00:3c (42:01:0a:f0:00:3c), Dst: 42:01:0a:f0:00:01 (42:01:0a:f0:00:01)
Internet Protocol Version 4, Src: 10.240.0.60, Dst: 130.211.203.133
Transmission Control Protocol, Src Port: 40280 (40280), Dst Port: 3306 (3306), Seq: 25887, Ack: 119320, Len: 501
[2 Reassembled TCP Segments (505 bytes): #465(4), #467(501)]
MySQL Protocol
    Packet Length: 501
    Packet Number: 0
    Request Command Prepare Statement
        Command: Prepare Statement (22)
        Statement [truncated]: select `process_instance`.`id`, `process_instance`.`start_time`, `process_instance`.`end_time`, `process_instance`.`data`, `process_instance`.`priority`, `process_instance`.`process_name`, `process_instance`.`resourc

No.     Time           Source                Destination           Protocol Length Info
    472 0.313944       10.240.0.60           130.211.203.133       MySQL    567    Request Prepare Statement

Frame 472: 567 bytes on wire (4536 bits), 567 bytes captured (4536 bits)
Ethernet II, Src: 42:01:0a:f0:00:3c (42:01:0a:f0:00:3c), Dst: 42:01:0a:f0:00:01 (42:01:0a:f0:00:01)
Internet Protocol Version 4, Src: 10.240.0.60, Dst: 130.211.203.133
Transmission Control Protocol, Src Port: 43360 (43360), Dst Port: 3306 (3306), Seq: 18, Ack: 57, Len: 501
[2 Reassembled TCP Segments (505 bytes): #471(4), #472(501)]
MySQL Protocol
    Packet Length: 501
    Packet Number: 0
    Request Command Prepare Statement
        Command: Prepare Statement (22)
        Statement [truncated]: select `process_instance`.`id`, `process_instance`.`start_time`, `process_instance`.`end_time`, `process_instance`.`data`, `process_instance`.`priority`, `process_instance`.`process_name`, `process_instance`.`resourc

No.     Time           Source                Destination           Protocol Length Info
    480 0.314233       10.240.0.60           130.211.203.133       MySQL    567    Request Prepare Statement

Frame 480: 567 bytes on wire (4536 bits), 567 bytes captured (4536 bits)
Ethernet II, Src: 42:01:0a:f0:00:3c (42:01:0a:f0:00:3c), Dst: 42:01:0a:f0:00:01 (42:01:0a:f0:00:01)
Internet Protocol Version 4, Src: 10.240.0.60, Dst: 130.211.203.133
Transmission Control Protocol, Src Port: 43372 (43372), Dst Port: 3306 (3306), Seq: 18, Ack: 57, Len: 501
[2 Reassembled TCP Segments (505 bytes): #479(4), #480(501)]
MySQL Protocol
    Packet Length: 501
    Packet Number: 0
    Request Command Prepare Statement
        Command: Prepare Statement (22)
        Statement [truncated]: select `process_instance`.`id`, `process_instance`.`start_time`, `process_instance`.`end_time`, `process_instance`.`data`, `process_instance`.`priority`, `process_instance`.`process_name`, `process_instance`.`resourc

No.     Time           Source                Destination           Protocol Length Info
    509 0.315740       10.240.0.60           130.211.203.133       MySQL    159    Request Prepare Statement

Frame 509: 159 bytes on wire (1272 bits), 159 bytes captured (1272 bits)
Ethernet II, Src: 42:01:0a:f0:00:3c (42:01:0a:f0:00:3c), Dst: 42:01:0a:f0:00:01 (42:01:0a:f0:00:01)
Internet Protocol Version 4, Src: 10.240.0.60, Dst: 130.211.203.133
Transmission Control Protocol, Src Port: 40280 (40280), Dst Port: 3306 (3306), Seq: 26440, Ack: 121767, Len: 93
[2 Reassembled TCP Segments (97 bytes): #507(4), #509(93)]
MySQL Protocol
    Packet Length: 93
    Packet Number: 0
    Request Command Prepare Statement
        Command: Prepare Statement (22)
        Statement: select count(*) from `process_execution` where `process_execution`.`process_instance_id` = ?

No.     Time           Source                Destination           Protocol Length Info
    516 0.316109       10.240.0.60           130.211.203.133       MySQL    159    Request Prepare Statement

Frame 516: 159 bytes on wire (1272 bits), 159 bytes captured (1272 bits)
Ethernet II, Src: 42:01:0a:f0:00:3c (42:01:0a:f0:00:3c), Dst: 42:01:0a:f0:00:01 (42:01:0a:f0:00:01)
Internet Protocol Version 4, Src: 10.240.0.60, Dst: 130.211.203.133
Transmission Control Protocol, Src Port: 43360 (43360), Dst Port: 3306 (3306), Seq: 571, Ack: 2504, Len: 93
[2 Reassembled TCP Segments (97 bytes): #515(4), #516(93)]
MySQL Protocol
    Packet Length: 93
    Packet Number: 0
    Request Command Prepare Statement
        Command: Prepare Statement (22)
        Statement: select count(*) from `process_execution` where `process_execution`.`process_instance_id` = ?

No.     Time           Source                Destination           Protocol Length Info
    523 0.316381       10.240.0.60           130.211.203.133       MySQL    159    Request Prepare Statement

Frame 523: 159 bytes on wire (1272 bits), 159 bytes captured (1272 bits)
Ethernet II, Src: 42:01:0a:f0:00:3c (42:01:0a:f0:00:3c), Dst: 42:01:0a:f0:00:01 (42:01:0a:f0:00:01)
Internet Protocol Version 4, Src: 10.240.0.60, Dst: 130.211.203.133
Transmission Control Protocol, Src Port: 43372 (43372), Dst Port: 3306 (3306), Seq: 571, Ack: 2504, Len: 93
[2 Reassembled TCP Segments (97 bytes): #522(4), #523(93)]
MySQL Protocol
    Packet Length: 93
    Packet Number: 0
    Request Command Prepare Statement
        Command: Prepare Statement (22)
        Statement: select count(*) from `process_execution` where `process_execution`.`process_instance_id` = ?

No.     Time           Source                Destination           Protocol Length Info
    558 0.317937       10.240.0.60           130.211.203.133       MySQL    567    Request Prepare Statement

Frame 558: 567 bytes on wire (4536 bits), 567 bytes captured (4536 bits)
Ethernet II, Src: 42:01:0a:f0:00:3c (42:01:0a:f0:00:3c), Dst: 42:01:0a:f0:00:01 (42:01:0a:f0:00:01)
Internet Protocol Version 4, Src: 10.240.0.60, Dst: 130.211.203.133
Transmission Control Protocol, Src Port: 40280 (40280), Dst Port: 3306 (3306), Seq: 26585, Ack: 121989, Len: 501
[2 Reassembled TCP Segments (505 bytes): #557(4), #558(501)]
MySQL Protocol
    Packet Length: 501
    Packet Number: 0
    Request Command Prepare Statement
        Command: Prepare Statement (22)
        Statement [truncated]: select `process_instance`.`id`, `process_instance`.`start_time`, `process_instance`.`end_time`, `process_instance`.`data`, `process_instance`.`priority`, `process_instance`.`process_name`, `process_instance`.`resourc

No.     Time           Source                Destination           Protocol Length Info
    559 0.317937       10.240.0.60           130.211.203.133       MySQL    567    Request Prepare Statement

Frame 559: 567 bytes on wire (4536 bits), 567 bytes captured (4536 bits)
Ethernet II, Src: 42:01:0a:f0:00:3c (42:01:0a:f0:00:3c), Dst: 42:01:0a:f0:00:01 (42:01:0a:f0:00:01)
Internet Protocol Version 4, Src: 10.240.0.60, Dst: 130.211.203.133
Transmission Control Protocol, Src Port: 43360 (43360), Dst Port: 3306 (3306), Seq: 716, Ack: 2726, Len: 501
[2 Reassembled TCP Segments (505 bytes): #556(4), #559(501)]
MySQL Protocol
    Packet Length: 501
    Packet Number: 0
    Request Command Prepare Statement
        Command: Prepare Statement (22)
        Statement [truncated]: select `process_instance`.`id`, `process_instance`.`start_time`, `process_instance`.`end_time`, `process_instance`.`data`, `process_instance`.`priority`, `process_instance`.`process_name`, `process_instance`.`resourc

No.     Time           Source                Destination           Protocol Length Info
    563 0.318267       10.240.0.60           130.211.203.133       MySQL    567    Request Prepare Statement

Frame 563: 567 bytes on wire (4536 bits), 567 bytes captured (4536 bits)
Ethernet II, Src: 42:01:0a:f0:00:3c (42:01:0a:f0:00:3c), Dst: 42:01:0a:f0:00:01 (42:01:0a:f0:00:01)
Internet Protocol Version 4, Src: 10.240.0.60, Dst: 130.211.203.133
Transmission Control Protocol, Src Port: 43372 (43372), Dst Port: 3306 (3306), Seq: 716, Ack: 2726, Len: 501
[2 Reassembled TCP Segments (505 bytes): #562(4), #563(501)]
MySQL Protocol
    Packet Length: 501
    Packet Number: 0
    Request Command Prepare Statement
        Command: Prepare Statement (22)
        Statement [truncated]: select `process_instance`.`id`, `process_instance`.`start_time`, `process_instance`.`end_time`, `process_instance`.`data`, `process_instance`.`priority`, `process_instance`.`process_name`, `process_instance`.`resourc

No.     Time           Source                Destination           Protocol Length Info
    601 0.319939       10.240.0.60           130.211.203.133       MySQL    1090   Request Prepare Statement

Frame 601: 1090 bytes on wire (8720 bits), 1090 bytes captured (8720 bits)
Ethernet II, Src: 42:01:0a:f0:00:3c (42:01:0a:f0:00:3c), Dst: 42:01:0a:f0:00:01 (42:01:0a:f0:00:01)
Internet Protocol Version 4, Src: 10.240.0.60, Dst: 130.211.203.133
Transmission Control Protocol, Src Port: 43360 (43360), Dst Port: 3306 (3306), Seq: 1269, Ack: 5173, Len: 1024
[2 Reassembled TCP Segments (1028 bytes): #599(4), #601(1024)]
MySQL Protocol
    Packet Length: 1024
    Packet Number: 0
    Request Command Prepare Statement
        Command: Prepare Statement (22)
        Statement [truncated]: select `instance`.`id`, `instance`.`name`, `instance`.`account_id`, `instance`.`kind`, `instance`.`uuid`, `instance`.`description`, `instance`.`state`, `instance`.`created`, `instance`.`removed`, `instance`.`remove_t

No.     Time           Source                Destination           Protocol Length Info
    604 0.320079       10.240.0.60           130.211.203.133       MySQL    1090   Request Prepare Statement

Frame 604: 1090 bytes on wire (8720 bits), 1090 bytes captured (8720 bits)
Ethernet II, Src: 42:01:0a:f0:00:3c (42:01:0a:f0:00:3c), Dst: 42:01:0a:f0:00:01 (42:01:0a:f0:00:01)
Internet Protocol Version 4, Src: 10.240.0.60, Dst: 130.211.203.133
Transmission Control Protocol, Src Port: 40280 (40280), Dst Port: 3306 (3306), Seq: 27138, Ack: 124436, Len: 1024
[2 Reassembled TCP Segments (1028 bytes): #602(4), #604(1024)]
MySQL Protocol
    Packet Length: 1024
    Packet Number: 0
    Request Command Prepare Statement
        Command: Prepare Statement (22)
        Statement [truncated]: select `instance`.`id`, `instance`.`name`, `instance`.`account_id`, `instance`.`kind`, `instance`.`uuid`, `instance`.`description`, `instance`.`state`, `instance`.`created`, `instance`.`removed`, `instance`.`remove_t

No.     Time           Source                Destination           Protocol Length Info
    608 0.320232       10.240.0.60           130.211.203.133       MySQL    1090   Request Prepare Statement

Frame 608: 1090 bytes on wire (8720 bits), 1090 bytes captured (8720 bits)
Ethernet II, Src: 42:01:0a:f0:00:3c (42:01:0a:f0:00:3c), Dst: 42:01:0a:f0:00:01 (42:01:0a:f0:00:01)
Internet Protocol Version 4, Src: 10.240.0.60, Dst: 130.211.203.133
Transmission Control Protocol, Src Port: 43372 (43372), Dst Port: 3306 (3306), Seq: 1269, Ack: 5173, Len: 1024
[2 Reassembled TCP Segments (1028 bytes): #607(4), #608(1024)]
MySQL Protocol
    Packet Length: 1024
    Packet Number: 0
    Request Command Prepare Statement
        Command: Prepare Statement (22)
        Statement [truncated]: select `instance`.`id`, `instance`.`name`, `instance`.`account_id`, `instance`.`kind`, `instance`.`uuid`, `instance`.`description`, `instance`.`state`, `instance`.`created`, `instance`.`removed`, `instance`.`remove_t

No.     Time           Source                Destination           Protocol Length Info
    653 0.322519       10.240.0.60           130.211.203.133       MySQL    1090   Request Prepare Statement

Frame 653: 1090 bytes on wire (8720 bits), 1090 bytes captured (8720 bits)
Ethernet II, Src: 42:01:0a:f0:00:3c (42:01:0a:f0:00:3c), Dst: 42:01:0a:f0:00:01 (42:01:0a:f0:00:01)
Internet Protocol Version 4, Src: 10.240.0.60, Dst: 130.211.203.133
Transmission Control Protocol, Src Port: 40280 (40280), Dst Port: 3306 (3306), Seq: 28214, Ack: 131827, Len: 1024
[2 Reassembled TCP Segments (1028 bytes): #652(4), #653(1024)]
MySQL Protocol
    Packet Length: 1024
    Packet Number: 0
    Request Command Prepare Statement
        Command: Prepare Statement (22)
